{
  "schema": "kofun.release-claims/v1",
  "manifest_version": 1,
  "public_sources": [
    "docs/MVP_IMPLEMENTED.md"
  ],
  "areas": [
    "bootstrap",
    "c-backend",
    "frameworks",
    "frontend",
    "interop",
    "native",
    "quality",
    "self-hosting",
    "tooling",
    "webassembly"
  ],
  "targets": [
    "c11",
    "host-c",
    "linux-x86_64",
    "native-aarch64",
    "native-x86_64",
    "repository",
    "selfhost",
    "stage1",
    "stage2",
    "wasm32"
  ],
  "claims": [
    {
      "id": "arithmetic-core",
      "public_wording": "arithmetic Core validation/emission",
      "public_status": "implemented",
      "state": "implemented",
      "area": "frontend",
      "bounded_capability": "The arithmetic Core is validated and emitted for the checked Int64 operator set; `/` is deliberately not part of it.",
      "targets": [
        "c11",
        "stage2"
      ],
      "specification": [
        "docs/SEMANTICS.md",
        "spec/semantics.md"
      ],
      "compatibility": "Operator semantics are covered by the numeric conformance corpus; additions arrive as new corpus cases rather than silent behaviour changes.",
      "positive_gate": {
        "command": "sh tests/cli.sh",
        "observation": "The arithmetic Core validates and emits without a diagnostic."
      },
      "negative_boundary": {
        "kind": "rejection",
        "evidence": "tests/conformance/numeric/reject_slash_operator.kofun",
        "observation": "`/` on `Int` is refused with one diagnostic instead of being lowered."
      },
      "safety": {
        "classification": "none"
      },
      "performance": {
        "classification": "none"
      },
      "reproduction": {
        "command": "task test",
        "prerequisites": []
      }
    },
    {
      "id": "borrowed-list-ownership",
      "public_wording": "borrowed-List Copy/move ownership check",
      "public_status": "narrow Stage 2 checkpoint",
      "state": "checkpoint",
      "area": "frontend",
      "bounded_capability": "Stage 2 rejects use-after-move for borrowed `List` bindings only. It is not a general ownership pass.",
      "targets": [
        "stage2"
      ],
      "specification": [
        "docs/MEMORY_MODEL.md"
      ],
      "compatibility": "Only the borrowed-`List` shape is promised; other ownership errors may still compile until the general pass lands.",
      "positive_gate": {
        "command": "sh bootstrap/stage2/check.sh",
        "observation": "The borrowed-List Copy/move checkpoint passes."
      },
      "negative_boundary": {
        "kind": "rejection",
        "evidence": "tests/compile-fail/use_after_take.kofun",
        "observation": "Using a moved binding is refused at compile time."
      },
      "safety": {
        "classification": "memory-safety",
        "threat_model": "docs/MEMORY_MODEL.md",
        "negative_test": "tests/compile-fail/use_after_take.kofun"
      },
      "performance": {
        "classification": "none"
      },
      "reproduction": {
        "command": "task stage2",
        "prerequisites": []
      }
    },
    {
      "id": "c-abi-profile",
      "public_wording": "C ABI `extern` / `repr(C)` profile",
      "public_status": "bounded host-C implementation",
      "state": "checkpoint",
      "area": "interop",
      "bounded_capability": "`extern` declarations and `repr(C)` layouts are honoured for the host C compiler only; no cross-ABI or cross-target promise is made.",
      "targets": [
        "host-c",
        "linux-x86_64"
      ],
      "specification": [
        "docs/RUST_CRATE_SHIMS.md"
      ],
      "compatibility": "Layout guarantees follow the host C compiler; changing compilers may change layout and is not a compatibility break in this profile.",
      "positive_gate": {
        "command": "sh bootstrap/c_abi/check.sh",
        "observation": "The C ABI profile builds and round-trips through host C."
      },
      "negative_boundary": {
        "kind": "limit",
        "evidence": "tests/conformance/capabilities.tsv",
        "observation": "Backends outside the host-C profile are recorded as unsupported with a stated reason."
      },
      "safety": {
        "classification": "none"
      },
      "performance": {
        "classification": "none"
      },
      "reproduction": {
        "command": "task c-abi",
        "prerequisites": [
          "cc"
        ]
      }
    },
    {
      "id": "c11-function-calls",
      "public_wording": "C11 user-function calls",
      "public_status": "bounded Int Core: recursion and forward calls",
      "state": "checkpoint",
      "area": "c-backend",
      "bounded_capability": "User functions lower to C11 for the Int Core, including recursion and forward references. Other value types are outside the slice.",
      "targets": [
        "c11",
        "stage2"
      ],
      "specification": [
        "docs/COMPILER_ARCHITECTURE.md"
      ],
      "compatibility": "Emitted C11 is deterministic for the covered slice; the exact text is pinned by the Stage 2 gate.",
      "positive_gate": {
        "command": "sh bootstrap/stage2/check.sh",
        "observation": "Int Core user-function calls lower and execute through C11."
      },
      "negative_boundary": {
        "kind": "rejection",
        "evidence": "tests/diagnostics/stage2/e2s10_unsupported_statement.kofun",
        "observation": "Statements outside the lowered slice are refused with `E2S10` rather than mis-lowered."
      },
      "safety": {
        "classification": "none"
      },
      "performance": {
        "classification": "none"
      },
      "reproduction": {
        "command": "task stage2",
        "prerequisites": [
          "cc"
        ]
      }
    },
    {
      "id": "checked-int64-contract",
      "public_wording": "checked Int64 contract",
      "public_status": "implemented for Core",
      "state": "implemented",
      "area": "frontend",
      "bounded_capability": "Every Core `Int` operation is checked: overflow and non-representable results are refused or trapped, never wrapped.",
      "targets": [
        "c11",
        "native-aarch64",
        "native-x86_64",
        "stage2",
        "wasm32"
      ],
      "specification": [
        "docs/SEMANTICS.md"
      ],
      "compatibility": "The checked contract holds across every backend that claims the Core; a backend that cannot honour it must report unsupported.",
      "positive_gate": {
        "command": "sh tests/conformance/run.sh",
        "observation": "The numeric conformance corpus passes on every supported backend."
      },
      "negative_boundary": {
        "kind": "trap",
        "evidence": "tests/conformance/numeric/reject_slash_operator.kofun",
        "observation": "Operations that cannot be represented are refused or trapped rather than wrapping."
      },
      "safety": {
        "classification": "refusal-boundary",
        "threat_model": "docs/SECURITY.md",
        "negative_test": "tests/conformance/numeric/reject_slash_operator.kofun"
      },
      "performance": {
        "classification": "none"
      },
      "reproduction": {
        "command": "task check",
        "prerequisites": []
      }
    },
    {
      "id": "cli-commands",
      "public_wording": "build/run/check/test CLI",
      "public_status": "Core only",
      "state": "checkpoint",
      "area": "tooling",
      "bounded_capability": "`build`, `run`, `check` and `test` accept Core sources. Sources outside the Core are refused by the driver, not partially compiled.",
      "targets": [
        "repository",
        "stage2"
      ],
      "specification": [
        "docs/GETTING_STARTED.md"
      ],
      "compatibility": "Command names and exit statuses are stable; the accepted source set grows with the Core.",
      "positive_gate": {
        "command": "sh tests/cli.sh",
        "observation": "Each subcommand succeeds on Core sources."
      },
      "negative_boundary": {
        "kind": "rejection",
        "evidence": "tests/cli_stage2_outcomes.sh",
        "observation": "Non-Core sources produce a refusal outcome instead of a partial build."
      },
      "safety": {
        "classification": "none"
      },
      "performance": {
        "classification": "none"
      },
      "reproduction": {
        "command": "task test",
        "prerequisites": []
      }
    },
    {
      "id": "cli-framework",
      "public_wording": "Linux x86-64 native CLI application framework",
      "public_status": "bounded direct-static implementation",
      "state": "checkpoint",
      "area": "frameworks",
      "bounded_capability": "The CLI framework produces a direct static Linux x86-64 binary for the declarative command profile. No dynamic linking or other host is covered.",
      "targets": [
        "linux-x86_64",
        "native-x86_64"
      ],
      "specification": [
        "docs/NATIVE_BACKEND.md"
      ],
      "compatibility": "Argument parsing and exit statuses are gated; the framework surface may grow between releases.",
      "positive_gate": {
        "command": "sh framework/cli/check.sh",
        "observation": "The declarative CLI example builds statically and runs."
      },
      "negative_boundary": {
        "kind": "limit",
        "evidence": "tests/conformance/capabilities.tsv",
        "observation": "Targets outside Linux x86-64 are recorded as unsupported with a stated reason."
      },
      "safety": {
        "classification": "none"
      },
      "performance": {
        "classification": "none"
      },
      "reproduction": {
        "command": "task cli-framework",
        "prerequisites": []
      }
    },
    {
      "id": "compiled-visibility-interfaces",
      "public_wording": "compiled visibility interfaces",
      "public_status": "bounded Stage 2 KIF v1.1: exact resolved flat-nominal function/payload refs; public/internal/private leak rejection; atomic public/internal filtering",
      "state": "checkpoint",